bea_code,bea_desc,windc_code,category
525000,"Funds, trusts, and other financial vehicles",fin_fin,goods
531HSO,Owner-occupied housing,own_hou,goods
531ORE,Other real estate,ore_ore,goods
532100,Automotive equipment rental and leasing,aut_rnt,goods
532400,Commercial and industrial machinery and equipment rental and leasing,com_rnt,goods
532A00,General and consumer goods rental,cmg_rnt,goods
533000,Lessors of nonfinancial intangible assets,int_rnt,goods
541100,Legal services,leg_leg,goods
541511,Custom computer programming services,cus_com,goods
541512,Computer systems design services,sys_com,goods
54151A,"Other computer related services, including facilities management",ocs_com,goods
541200,"Accounting, tax preparation, bookkeeping, and payroll services",acc_tsv,goods
541300,"Architectural, engineering, and related services",arc_tsv,goods
541610,Management consulting services,mgt_tsv,goods
5416A0,Environmental and other technical consulting services,env_tsv,goods
541700,Scientific research and development services,sci_tsv,goods
541800,"Advertising, public relations, and related services",adv_tsv,goods
541400,Specialized design services,des_tsv,goods
541920,Photographic services,pht_tsv,goods
541940,Veterinary services,vet_tsv,goods
5419A0,"All other miscellaneous professional, scientific, and technical services",mkt_tsv,goods
550000,Management of companies and enterprises,man_man,goods
561300,Employment services,emp_adm,goods
561700,Services to buildings and dwellings,dwe_adm,goods
561100,Office administrative services,off_adm,goods
561200,Facilities support services,fac_adm,goods
561400,Business support services,bsp_adm,goods
561500,Travel arrangement and reservation services,trv_adm,goods
561600,Investigation and security services,inv_adm,goods
561900,Other support services,oss_adm,goods
562000,Waste management and remediation services,wst_wst,goods
611100,Elementary and secondary schools,sec_edu,goods
611A00,"Junior colleges, colleges, universities, and professional schools",uni_edu,goods
611B00,Other educational services,oes_edu,goods
621100,Offices of physicians,phy_amb,goods
621200,Offices of dentists,dnt_amb,goods
621300,Offices of other health practitioners,ohp_amb,goods
621400,Outpatient care centers,out_amb,goods
621500,Medical and diagnostic laboratories,lab_amb,goods
621600,Home health care services,hom_amb,goods
621900,Other ambulatory health care services,oas_amb,goods
622000,Hospitals,hos_hos,goods
623A00,Nursing and community care facilities,ncc_nrs,goods
623B00,"Residential mental health, substance abuse, and other residential care facilities",res_nrs,goods
624100,Individual and family services,ifs_soc,goods
624400,Child day care services,day_soc,goods
624A00,"Community food, housing, and other relief services, including rehabilitation services",cmf_soc,goods
711100,Performing arts companies,pfm_art,goods
711200,Spectator sports,spr_art,goods
711500,"Independent artists, writers, and performers",ind_art,goods
711A00,Promoters of performing arts and sports and agents for public figures,agt_art,goods
712000,"Museums, historical sites, zoos, and parks",mus_art,goods
713100,Amusement parks and arcades,amu_rec,goods
713200,Gambling industries (except casino hotels),cas_rec,goods
713900,Other amusement and recreation industries,ori_rec,goods
721000,Accommodation,amd_amd,goods
722110,Full-service restaurants,ful_res,goods
722211,Limited-service restaurants,lim_res,goods
722A00,All other food and drinking places,ofd_res,goods
811100,Automotive repair and maintenance,atr_osv,goods
811200,Electronic and precision equipment repair and maintenance,eqr_osv,goods
811300,Commercial and industrial machinery and equipment repair and maintenance,imr_osv,goods
811400,Personal and household goods repair and maintenance,hgr_osv,goods
812100,Personal care services,pcs_osv,goods
812200,Death care services,fun_osv,goods
812300,Dry-cleaning and laundry services,dry_osv,goods
812900,Other personal services,ops_osv,goods
813100,Religious organizations,rel_osv,goods
813A00,"Grantmaking, giving, and social advocacy organizations",grt_osv,goods
813B00,"Civic, social, professional, and similar organizations",civ_osv,goods
814000,Private households,prv_osv,goods
S00500,Federal general government (defense),fdd_fdd,goods
S00600,Federal general government (nondefense),fnd_fnd,goods
491000,Postal service,pst_fen,goods
S00102,Other federal government enterprises,ofg_fen,goods
GSLGE,State and local government educational services,edu_slg,goods
GSLGH,State and local government hospitals and health services,hea_slg,goods
GSLGO,State and local government other services,oth_slg,goods
S00203,Other state and local government enterprises,ent_sle,goods
S00401,Scrap,srp_use,goods
S00402,Used and secondhand goods,sec_use,goods
S00300,Noncomparable imports,imp_oth,goods
S00900,Rest of the world adjustment,rwa_oth,goods
331314,Secondary smelting and alloying of aluminum,sme_pmt,goods
S00101,Federal electric utilities,ele_fen,goods
S00201,State and local government passenger transit,trn_sle,goods
S00202,State and local government electric utilities,ele_sle,goods
TRADE,Trade margins,Margins,
TRANS,Transportation costs,TrnCost,
T005,Total intermediate inputs,interm,
V00100,Compensation of employees,compen,valueadded
V00300,Gross operating surplus,surplus,valueadded
VABAS,Value added (basic value),basicvalueadded,
T018,Total industry output (basic value),industryoutput,
T00TOP,Plus: Taxes on products and imports,taxes,
T00SUB,Less: Subsidies,subsidies,
VAPRO,Value added (producer value),valueadded,
F01000,Personal consumption expenditures,pce,finaldemand
F02E00,Nonresidential private fixed investment in equipment,equipment,finaldemand
F02N00,Nonresidential private fixed investment in intellectual property products,intelprop,finaldemand
F02R00,Residential private fixed investment,residential,finaldemand
F02S00,Nonresidential private fixed investment in structures,structures,finaldemand
F03000,Change in private inventories,changinv,finaldemand
F04000,Exports of goods and services,exports,
F06C00,Federal Government defense: Consumption expenditures,defense,finaldemand
F06E00,Federal national defense: Gross investment in equipment,def_equipment,finaldemand
F07C00,Federal Government nondefense: Consumption expenditures,nondefense,finaldemand
F06N00,Federal national defense: Gross investment in intellectual property products,def_intelprop,finaldemand
F06S00,Federal national defense: Gross investment in structures,def_structures,finaldemand
F07E00,Federal nondefense: Gross investment in equipment,fed_equipment,finaldemand
F07S00,Federal nondefense: Gross investment in structures,fed_structures,finaldemand
F07N00,Federal nondefense: Gross investment in intellectual property products,fed_intelprop,finaldemand
F10C00,State and local government consumption expenditures,state_consume,finaldemand
F10E00,State and local: Gross investment in equipment,state_equipment,finaldemand
F10N00,State and local: Gross investment in intellectual property products,state_intelprop,finaldemand
F10S00,State and local: Gross investment in structures,state_invest,finaldemand
