bea_code,bea_desc,bea_level
325610,Soap and cleaning compound manufacturing,detail
325620,Toilet preparation manufacturing,detail
325910,Printing ink manufacturing,detail
3259A0,All other chemical product and preparation manufacturing,detail
326110,Plastics packaging materials and unlaminated film and sheet manufacturing,detail
326120,"Plastics pipe, pipe fitting, and unlaminated profile shape manufacturing",detail
326130,"Laminated plastics plate, sheet (except packaging), and shape manufacturing",detail
326140,Polystyrene foam product manufacturing,detail
326150,Urethane and other foam product (except polystyrene) manufacturing,detail
326160,Plastics bottle manufacturing,detail
326190,Other plastics product manufacturing,detail
326210,Tire manufacturing,detail
326220,Rubber and plastics hoses and belting manufacturing,detail
326290,Other rubber product manufacturing,detail
423100,Motor vehicle and motor vehicle parts and supplies,detail
423400,Professional and commercial equipment and supplies,detail
423600,Household appliances and electrical and electronic goods,detail
423800,"Machinery, equipment, and supplies",detail
423A00,Other durable goods merchant wholesalers,detail
424200,Drugs and druggists' sundries,detail
424400,Grocery and related product wholesalers,detail
424700,Petroleum and petroleum products,detail
424A00,Other nondurable goods merchant wholesalers,detail
425000,Wholesale electronic markets and agents and brokers,detail
4200ID,Customs duties,detail
441000,Motor vehicle and parts dealers,detail
445000,Food and beverage stores,detail
452000,General merchandise stores,detail
444000,Building material and garden equipment and supplies dealers,detail
446000,Health and personal care stores,detail
447000,Gasoline stations,detail
448000,Clothing and clothing accessories stores,detail
454000,Nonstore retailers,detail
4B0000,All other retail,detail
481000,Air transportation,detail
482000,Rail transportation,detail
483000,Water transportation,detail
484000,Truck transportation,detail
485000,Transit and ground passenger transportation,detail
486000,Pipeline transportation,detail
48A000,Scenic and sightseeing transportation and support activities,detail
492000,Couriers and messengers,detail
493000,Warehousing and storage,detail
511110,Newspaper publishers,detail
511120,Periodical publishers,detail
511130,Book publishers,detail
5111A0,"Directory, mailing list, and other publishers",detail
511200,Software publishers,detail
512100,Motion picture and video industries,detail
512200,Sound recording industries,detail
515100,Radio and television broadcasting,detail
515200,Cable and other subscription programming,detail
517110,Wired telecommunications carriers,detail
517210,Wireless telecommunications carriers (except satellite),detail
517A00,"Satellite, telecommunications resellers, and all other telecommunications",detail
518200,"Data processing, hosting, and related services",detail
519130,Internet publishing and broadcasting and Web search portals,detail
5191A0,"News syndicates, libraries, archives and all other information services",detail
52A000,Monetary authorities and depository credit intermediation,detail
522A00,Nondepository credit intermediation and related activities,detail
523A00,Securities and commodity contracts intermediation and brokerage,detail
523900,Other financial investment activities,detail
524113,Direct life insurance carriers,detail
5241XX,"Insurance carriers, except direct life",detail
524200,"Insurance agencies, brokerages, and related activities",detail
525000,"Funds, trusts, and other financial vehicles",detail
531HSO,Owner-occupied housing,detail
531HST,Tenant-occupied housing,detail
531ORE,Other real estate,detail
532100,Automotive equipment rental and leasing,detail
532A00,General and consumer goods rental,detail
532400,Commercial and industrial machinery and equipment rental and leasing,detail
533000,Lessors of nonfinancial intangible assets,detail
541100,Legal services,detail
541200,"Accounting, tax preparation, bookkeeping, and payroll services",detail
541300,"Architectural, engineering, and related services",detail
541610,Management consulting services,detail
5416A0,Environmental and other technical consulting services,detail
541700,Scientific research and development services,detail
541800,"Advertising, public relations, and related services",detail
541400,Specialized design services,detail
5419A0,"All other miscellaneous professional, scientific, and technical services",detail
541920,Photographic services,detail
541940,Veterinary services,detail
541511,Custom computer programming services,detail
541512,Computer systems design services,detail
54151A,"Other computer related services, including facilities management",detail
550000,Management of companies and enterprises,detail
561300,Employment services,detail
561700,Services to buildings and dwellings,detail
561100,Office administrative services,detail
561200,Facilities support services,detail
561400,Business support services,detail
561500,Travel arrangement and reservation services,detail
561600,Investigation and security services,detail
561900,Other support services,detail
562000,Waste management and remediation services,detail
611100,Elementary and secondary schools,detail
611A00,"Junior colleges, colleges, universities, and professional schools",detail
611B00,Other educational services,detail
621100,Offices of physicians,detail
621200,Offices of dentists,detail
621300,Offices of other health practitioners,detail
621400,Outpatient care centers,detail
621500,Medical and diagnostic laboratories,detail
621600,Home health care services,detail
621900,Other ambulatory health care services,detail
622000,Hospitals,detail
623A00,Nursing and community care facilities,detail
623B00,"Residential mental health, substance abuse, and other residential care facilities",detail
624100,Individual and family services,detail
624A00,"Community food, housing, and other relief services, including vocational rehabilitation services",detail
624400,Child day care services,detail
711100,Performing arts companies,detail
711200,Spectator sports,detail
711A00,Promoters of performing arts and sports and agents for public figures,detail
711500,"Independent artists, writers, and performers",detail
712000,"Museums, historical sites, zoos, and parks",detail
713100,Amusement parks and arcades,detail
713200,Gambling industries (except casino hotels),detail
713900,Other amusement and recreation industries,detail
721000,Accommodation,detail
722110,Full-service restaurants,detail
722211,Limited-service restaurants,detail
722A00,All other food and drinking places,detail
811100,Automotive repair and maintenance (including car washes),detail
811200,Electronic and precision equipment repair and maintenance,detail
811300,Commercial and industrial machinery and equipment repair and maintenance,detail
811400,Personal and household goods repair and maintenance,detail
812100,Personal care services,detail
812200,Death care services,detail
812300,Dry-cleaning and laundry services,detail
812900,Other personal services,detail
813100,Religious organizations,detail
813A00,"Grantmaking, giving, and social advocacy organizations",detail
813B00,"Civic, social, professional, and similar organizations",detail
814000,Private households,detail
S00500,Federal general government (defense),detail
S00600,Federal general government (nondefense),detail
491000,Postal service,detail
S00101,Federal electric utilities,detail
S00102,Other federal government enterprises,detail
GSLGE,State and local government (educational services),detail
GSLGH,State and local government (hospitals and health services),detail
GSLGO,State and local government (other services),detail
S00201,State and local government passenger transit,detail
S00202,State and local government electric utilities,detail
S00203,Other state and local government enterprises,detail
S00401,Scrap,detail
S00402,Used and secondhand goods,detail
S00300,Noncomparable imports,detail
S00900,Rest of the world adjustment,detail
